Name,Description,Latitude,Longitude,InfoURL,ImageURL
UCSB,A great university located along the California coast!,34.416929,-119.845991,"https://en.wikipedia.org/wiki/University_of_California, _Santa_Barbara",https://www.history.ucsb.edu/wp- content/uploads/LagoonFall2014-banner.jpg
"Tenaya Lake, CA",A beautiful glacial lake in Yosemite National Park.,37.831851,-119.460007,https://en.wikipedia.org/wiki/Tenaya_Lake,https://upload.wikimedia.org/wikipedia/commons/thumb/6/67/Tenaya_Lake_120%C2%B0_pano.jpg/1920px-Tenaya_Lake_120%C2%B0_pano.jpg
"Piedra Blanca Trail, Ojai CA ",An amazing hiking and camping trail in the Los Padres National Forest.,34.560165,-119.164655,https://www.fs.usda.gov/recarea/lpnf/recarea/?recid=81832,https://www.nrtdatabase.org/trailPhotos/2145_2145_Los_Padres.JPG
"Waimea Bay, O'ahu, HI",The best beach on the North Shore of O'ahu.,21.641505,-158.067127,https://en.wikipedia.org/wiki/Waimea_Bay,https://www.best-of-oahu.com/images/Waimea-Bay-Hawaii.jpg
"Avalon, Catalina Island, CA",The main city on Catalina Island off the shore of Southern California.,33.342819,-118.328228,https://en.wikipedia.org/wiki/Santa_Catalina_Island_(California),"https://assets.simpleviewinc.com/simpleview/image/upload/c_fill,h_640,q_60,w_1600/v1/clients/catalinaisland/AvalonScenicDrive_2008_1_f949903d-87ef-4699-b39b-a288e57da63d.jpg"
"Emma Wood State Beach, Ventura, CA",A beach near my hometown where I spent my childhood camping.,34.29323,-119.339852,https://www.parks.ca.gov/?page_id=604,https://www.californiabeaches.com/wp-content/uploads/2014/09/IMG_7982-Large-e1512523587120-1000x595.jpg